{
  "schemaVersion": "personal-growth-instagram-recommendation/1",
  "recommendationDate": "2026-08-28",
  "generatedAt": "2026-08-27T21:00:00.000Z",
  "actionType": "no-post",
  "format": "none",
  "pillar": null,
  "goal": null,
  "dueWindow": null,
  "ownerSourceRefs": [],
  "collaborator": null,
  "assetChecklist": [],
  "distributionChecklist": [],
  "storiesSupport": [],
  "projectedPersonalRatio": null,
  "goviralSignalId": null,
  "activeExperimentId": null,
  "reason": "No owner-grounded action is due.",
  "noPostReason": "no-useful-candidate",
  "reel": null,
  "manualVentureReferenceId": null,
  "ownerWritesArtifact": true,
  "publishingAuthorized": false
}
